{
  "schema_version": 1,
  "id": "mario-kart-world",
  "description": "Mario Kart World single-race autonomous driving profile. Complete the selected 50cc race while staying on the road.",
  "game": "Mario Kart World on Nintendo Switch",
  "introduction": "A third-person kart racing game on Nintendo Switch. A race has a countdown, a three-lap road course, opponents, items, a minimap, a lap counter, and a results screen. The kart must stay on the visible road, pass checkpoints, and reach the finish; winning is not required for a completed run.",
  "objective": "Drive forward while staying on the track and choose short safe corrections.",
  "state_notes": "During active racing, A must normally remain held. Prefer accelerate when the road ahead is clear, and use small A+left_stick corrections only when the road bends. If the kart is against a wall, on grass, stationary, or facing away from the road, choose recover_left or recover_right to brake/reverse while steering back toward asphalt. Use drift actions only for a clearly visible bend. Use WAIT only for menus, loading, countdown/results screens, or a clear recovery pause; do not choose WAIT merely because the kart is in a straight section. The race is complete when a results/ranking screen replaces the driving HUD.",
  "controller": {
    "platform": "Nintendo Switch",
    "layout": "Switch Pro Controller",
    "button_encoding": "buttons is a simultaneous button list; left_stick and right_stick axes are normalized from -1 to 1; y=1 means up",
    "supports_simultaneous": true,
    "supports_sticks": true,
    "supports_motion": false,
    "unsupported_sensors": [
      "gyroscope",
      "accelerometer",
      "rumble"
    ]
  },
  "gameplay": {
    "mode": "single_race",
    "race_laps": 3,
    "completion_signal": "results_screen",
    "active_states": [
      "countdown",
      "racing",
      "finish_sequence"
    ],
    "non_active_states": [
      "home_menu",
      "game_menu",
      "loading",
      "results"
    ]
  },
  "controls": {
    "A": {
      "type": "button",
      "meaning": "加速",
      "how_to_press": "按住；buttons 中保持 A，必要时与左摇杆同时输入",
      "when_to_use": "倒计时结束后、道路可行驶时持续前进"
    },
    "B": {
      "type": "button",
      "meaning": "刹车或倒车",
      "how_to_press": "需要减速时短按或按住",
      "when_to_use": "急弯、撞墙、需要脱离障碍或明确需要倒车时"
    },
    "X": {
      "type": "button",
      "meaning": "使用当前道具",
      "how_to_press": "拿到道具且确认要使用时短按",
      "when_to_use": "前方有目标或需要防御时；不确定时不要使用"
    },
    "Y": {
      "type": "button",
      "meaning": "回头观察或游戏映射的次要动作",
      "how_to_press": "短按；不要与持续驾驶动作混淆",
      "when_to_use": "需要确认后方或画面明确提示该动作时"
    },
    "L": {
      "type": "button",
      "meaning": "左肩键；漂移或游戏映射的肩部动作",
      "how_to_press": "按住或短按，取决于画面中的漂移提示",
      "when_to_use": "需要漂移、跳跃或画面明确提示时"
    },
    "R": {
      "type": "button",
      "meaning": "右肩键；漂移或游戏映射的肩部动作",
      "how_to_press": "按住或短按，取决于画面中的漂移提示",
      "when_to_use": "需要漂移、跳跃或画面明确提示时"
    },
    "ZL": {
      "type": "button",
      "meaning": "左扳机；刹车或映射动作",
      "how_to_press": "短按或按住；与 A 同时按下前应确认游戏映射",
      "when_to_use": "需要刹车、瞄准或画面明确提示时"
    },
    "ZR": {
      "type": "button",
      "meaning": "右扳机；加速或映射动作",
      "how_to_press": "按住；若该赛制把 ZR 映射为加速，可替代 A",
      "when_to_use": "只有画面或配置确认 ZR 是加速时使用"
    },
    "UP": {
      "type": "button",
      "meaning": "十字键上",
      "how_to_press": "短按；与其他按钮可以同时输入",
      "when_to_use": "菜单导航或游戏明确使用十字键上时"
    },
    "DOWN": {
      "type": "button",
      "meaning": "十字键下",
      "how_to_press": "短按；与其他按钮可以同时输入",
      "when_to_use": "菜单导航或游戏明确使用十字键下时"
    },
    "LEFT": {
      "type": "button",
      "meaning": "十字键左",
      "how_to_press": "短按；与其他按钮可以同时输入",
      "when_to_use": "菜单导航或游戏明确使用十字键左时"
    },
    "RIGHT": {
      "type": "button",
      "meaning": "十字键右",
      "how_to_press": "短按；与其他按钮可以同时输入",
      "when_to_use": "菜单导航或游戏明确使用十字键右时"
    },
    "L3": {
      "type": "button",
      "meaning": "按下左摇杆",
      "how_to_press": "短按左摇杆；当前比赛通常不用",
      "when_to_use": "画面明确提示或需要游戏映射的摇杆按下动作时"
    },
    "R3": {
      "type": "button",
      "meaning": "按下右摇杆",
      "how_to_press": "短按右摇杆；当前比赛通常不用",
      "when_to_use": "画面明确提示或需要游戏映射的摇杆按下动作时"
    },
    "PLUS": {
      "type": "system",
      "meaning": "暂停或打开菜单",
      "how_to_press": "短按；暂停后再次短按可以返回",
      "when_to_use": "需要暂停、退出或画面明确提示时；比赛中不要误按"
    },
    "MINUS": {
      "type": "system",
      "meaning": "打开地图、辅助菜单或次级菜单",
      "how_to_press": "短按；确认画面提示后使用",
      "when_to_use": "需要查看地图或游戏明确提示时"
    },
    "HOME": {
      "type": "system",
      "meaning": "返回 Switch 系统主页",
      "how_to_press": "短按；这是主机级操作",
      "when_to_use": "仅在明确要离开游戏时；自动比赛中禁止使用"
    },
    "CAPTURE": {
      "type": "system",
      "meaning": "保存 Switch 截图或视频",
      "how_to_press": "短按；不会推进比赛",
      "when_to_use": "仅在用户要求记录画面时"
    },
    "LEFT_STICK": {
      "type": "stick",
      "meaning": "控制卡丁车左右转向",
      "how_to_press": "left_stick.x 使用 -1 到 1；负数左转、正数右转，y 通常为 0；与 A 同时输入",
      "when_to_use": "根据道路曲率做小幅修正；先看道路再输入，避免满舵"
    },
    "RIGHT_STICK": {
      "type": "stick",
      "meaning": "控制视角或游戏映射的相机动作",
      "how_to_press": "right_stick.x/y 使用 -1 到 1；没有明确需要时保持 0",
      "when_to_use": "需要观察周围或画面明确提示时；正常驾驶优先保持中立"
    },
    "WAIT": {
      "type": "neutral",
      "meaning": "释放所有按钮并让两个摇杆回中",
      "how_to_press": "buttons=[\"WAIT\"]，left_stick 和 right_stick 都不发送",
      "when_to_use": "菜单、加载、结果画面或明确需要安全回中时；活动赛道直道不能因为犹豫就等待"
    }
  },
  "observations": {
    "road": {
      "meaning": "前方可行驶的柏油路或标记赛道",
      "how_to_read": "观察道路边界、弯道方向、墙体和草地；草地、墙和障碍物不是目标路线",
      "when_relevant": "每次决定加速或转向时"
    },
    "minimap": {
      "meaning": "赛道形状、当前路线和赛车位置",
      "how_to_read": "作为道路画面的辅助，不替代前方道路视野",
      "when_relevant": "前方暂时被遮挡或需要判断即将到来的弯道时"
    },
    "lap_counter": {
      "meaning": "当前圈数与总圈数",
      "how_to_read": "左下角显示当前圈/总圈；本配置总计三圈",
      "when_relevant": "确认比赛是否仍在进行，以及是否接近完成时"
    },
    "race_state": {
      "meaning": "菜单、加载、倒计时、比赛、结算等状态",
      "how_to_read": "有驾驶 HUD 和赛道时是 active；排名/结果界面替换驾驶 HUD 后视为完成",
      "when_relevant": "决定继续按 A 还是发送 WAIT 时"
    },
    "stuck_state": {
      "meaning": "赛车被墙、草地或障碍物阻挡，速度明显下降或车头不在道路方向",
      "how_to_read": "结合车身相对道路边界的位置、前方障碍物和连续画面中的位移判断；单帧不确定时不要立刻倒车",
      "when_relevant": "连续加速没有前进、车身贴墙或偏离赛道时"
    }
  },
  "capture": {
    "device": "Hagibis",
    "size": "640x480",
    "framerate": 10
  },
  "runtime": {
    "decision_interval_ms": 500,
    "action_duration_ms": 1800,
    "min_action_confidence": 0.25
  },
  "candidates": [
    {
      "id": "accelerate",
      "buttons": [
        "A"
      ],
      "duration_ms": 1800,
      "intent": "保持赛车前进",
      "when_to_use": "active racing 且前方道路清晰",
      "description": "Active race default: hold A and drive straight when the visible road ahead is clear."
    },
    {
      "id": "steer_left",
      "buttons": [
        "A"
      ],
      "left_stick": {
        "x": -0.2,
        "y": 0
      },
      "duration_ms": 1800,
      "intent": "沿道路向左修正",
      "when_to_use": "道路向左弯或赛车偏向右侧",
      "description": "Hold A and make a small left correction that follows the visible road."
    },
    {
      "id": "steer_right",
      "buttons": [
        "A"
      ],
      "left_stick": {
        "x": 0.2,
        "y": 0
      },
      "duration_ms": 1800,
      "intent": "沿道路向右修正",
      "when_to_use": "道路向右弯或赛车偏向左侧",
      "description": "Hold A and make a small right correction that follows the visible road."
    },
    {
      "id": "drift_left",
      "buttons": [
        "A",
        "R"
      ],
      "left_stick": {
        "x": -0.45,
        "y": 0
      },
      "duration_ms": 1000,
      "intent": "在左弯中漂移",
      "when_to_use": "看见持续左弯且道路空间足够",
      "description": "Hold A and R with a moderate left stick input for a visible left bend; avoid on a straight."
    },
    {
      "id": "drift_right",
      "buttons": [
        "A",
        "R"
      ],
      "left_stick": {
        "x": 0.45,
        "y": 0
      },
      "duration_ms": 1000,
      "intent": "在右弯中漂移",
      "when_to_use": "看见持续右弯且道路空间足够",
      "description": "Hold A and R with a moderate right stick input for a visible right bend; avoid on a straight."
    },
    {
      "id": "use_item",
      "buttons": [
        "A",
        "X"
      ],
      "duration_ms": 250,
      "intent": "保持加速并使用道具",
      "when_to_use": "道具图标明确可用且使用时机清晰",
      "description": "Press A and X together to use a held item without dropping acceleration."
    },
    {
      "id": "recover_left",
      "buttons": [
        "B"
      ],
      "left_stick": {
        "x": -0.8,
        "y": 0
      },
      "duration_ms": 900,
      "intent": "向左倒车脱困",
      "when_to_use": "车身贴右侧墙、偏离道路或连续加速没有前进",
      "description": "Brake or reverse with B while steering left to leave a right-side wall or grass."
    },
    {
      "id": "recover_right",
      "buttons": [
        "B"
      ],
      "left_stick": {
        "x": 0.8,
        "y": 0
      },
      "duration_ms": 900,
      "intent": "向右倒车脱困",
      "when_to_use": "车身贴左侧墙、偏离道路或连续加速没有前进",
      "description": "Brake or reverse with B while steering right to leave a left-side wall or grass."
    },
    {
      "id": "hold",
      "buttons": [
        "WAIT"
      ],
      "duration_ms": 250,
      "intent": "控制器回中",
      "when_to_use": "菜单、加载、结果或明确需要恢复控制时",
      "description": "Emergency neutral only for menus, loading/results, or a clear recovery pause; do not use on an active straight road."
    }
  ]
}
